{
  "schemaVersion": 1,
  "publisher": "crashmedia.ca",
  "generatedAt": "2026-04-24T00:00:00Z",
  "channel": "stable",
  "version": "0.1.0",
  "notes": "Initial Linux release of the CMRemote Rust agent. Both .deb and .rpm artifacts are produced from the same x86_64-unknown-linux-gnu release build; integrity is pinned by SHA-256, signature verification is gated on Track S / S5 (cosign keyless) and is exercised by the release workflow.",
  "builds": [
    {
      "agentVersion": "0.1.0",
      "target": "x86_64-unknown-linux-gnu",
      "format": "deb",
      "file": "cmremote-agent_0.1.0-1_amd64.deb",
      "size": 4194304,
      "sha256": "0000000000000000000000000000000000000000000000000000000000000000",
      "signature": "cmremote-agent_0.1.0-1_amd64.deb.cosign.bundle",
      "signedBy": "https://github.com/CrashMediaIT/CMRemote/.github/workflows/release.yml@refs/tags/v0.1.0"
    },
    {
      "agentVersion": "0.1.0",
      "target": "x86_64-unknown-linux-gnu",
      "format": "rpm",
      "file": "cmremote-agent-0.1.0-1.x86_64.rpm",
      "size": 4194304,
      "sha256": "0000000000000000000000000000000000000000000000000000000000000000",
      "signature": "cmremote-agent-0.1.0-1.x86_64.rpm.cosign.bundle",
      "signedBy": "https://github.com/CrashMediaIT/CMRemote/.github/workflows/release.yml@refs/tags/v0.1.0"
    }
  ]
}
